{
  "$schema": "../schemas/whats-missing-rules.schema.json",
  "$comment": "What's missing rules (gap groups, concepts, score inputs, decision probes, thresholds, terms and wording). A shared clinical rule file: the web (lib/pane-engine/src/whats-missing) and iOS (WhatsMissingRules.swift through SharedClinicalContent) read this one file; lint:shared-content checks it against clinical-content/schemas/whats-missing-rules.schema.json and both platforms' types. Needs sign-off: docs/clinical-validation/changes/whats-missing.md.",
  "id": "whats-missing",
  "version": "1.0.0",
  "status": "needs-sign-off",
  "topN": 5,
  "tiers": ["safety", "decision", "score"],
  "groups": [
    { "id": "weight", "tier": "safety", "safetyOrder": 1, "what": "Weight not recorded", "partsWhat": "{Parts} not recorded", "action": { "kind": "field", "field": "weight" } },
    { "id": "allergy", "tier": "safety", "safetyOrder": 2, "what": "Allergy status not recorded", "action": { "kind": "field", "field": "allergies" } },
    { "id": "pregnancy", "tier": "safety", "safetyOrder": 3, "what": "Pregnancy status not recorded", "action": { "kind": "test", "test": "Urine pregnancy test (β-hCG)" }, "alt": { "kind": "field", "field": "pregnancy" } },
    { "id": "renal", "tier": "safety", "safetyOrder": 4, "what": "Renal function not on file", "partsWhat": "Renal function: {parts} not on file", "action": { "kind": "test", "test": "U&E with creatinine and eGFR" } },
    { "id": "anticoag-last-dose", "tier": "safety", "safetyOrder": 5, "what": "Anticoagulant last dose not recorded", "action": { "kind": "field", "field": "medications" } },
    { "id": "supplements", "tier": "safety", "safetyOrder": 6, "what": "Herbs and supplements not asked", "action": { "kind": "field", "field": "supplements" } },
    { "id": "cfs", "tier": "decision", "what": "Clinical Frailty Scale not recorded", "action": { "kind": "field", "field": "score:cfs" } },
    { "id": "asa", "tier": "decision", "what": "ASA grade not recorded", "action": { "kind": "field", "field": "score:asa" } },
    { "id": "has-bled", "tier": "decision", "what": "HAS-BLED not recorded", "action": { "kind": "field", "field": "score:has-bled" } },
    { "id": "ferritin", "tier": "decision", "what": "Ferritin not on file", "action": { "kind": "test", "test": "Ferritin" } },
    { "id": "obs", "tier": "score", "what": "Observations not recorded", "partsWhat": "Observations not recorded: {parts}", "action": { "kind": "field", "field": "vitals" } },
    { "id": "fbc", "tier": "score", "what": "Full blood count not on file", "partsWhat": "Full blood count: {parts} not on file", "action": { "kind": "test", "test": "Full blood count (FBC)" } },
    { "id": "crp", "tier": "score", "what": "CRP not on file", "action": { "kind": "test", "test": "C-reactive protein (CRP)" } },
    { "id": "lfts", "tier": "score", "what": "Liver function tests not on file", "partsWhat": "Liver function tests: {parts} not on file", "action": { "kind": "test", "test": "Liver function tests (LFTs)" } },
    { "id": "coag", "tier": "score", "what": "INR not on file", "action": { "kind": "test", "test": "Prothrombin time (PT/INR)" } },
    { "id": "imaging-us", "tier": "score", "what": "No ultrasound report on file", "action": { "kind": "test", "test": "Ultrasound abdomen (RUQ)" } }
  ],
  "concepts": [
    { "id": "height", "group": "weight", "part": "height" },
    { "id": "weight", "group": "weight", "part": "weight" },
    { "id": "urea", "group": "renal", "part": "urea" },
    { "id": "creatinine", "group": "renal", "part": "creatinine" },
    { "id": "egfr", "group": "renal", "part": "eGFR" },
    { "id": "rr", "group": "obs", "part": "RR" },
    { "id": "spo2", "group": "obs", "part": "SpO₂" },
    { "id": "o2", "group": "obs", "part": "air/O₂" },
    { "id": "sbp", "group": "obs", "part": "BP" },
    { "id": "hr", "group": "obs", "part": "HR" },
    { "id": "avpu", "group": "obs", "part": "ACVPU" },
    { "id": "temp", "group": "obs", "part": "temperature" },
    { "id": "wbc", "group": "fbc", "part": "WBC" },
    { "id": "neutrophils", "group": "fbc", "part": "neutrophils" },
    { "id": "hb", "group": "fbc", "part": "Hb" },
    { "id": "crp", "group": "crp", "part": "CRP" },
    { "id": "bilirubin", "group": "lfts", "part": "bilirubin" },
    { "id": "albumin", "group": "lfts", "part": "albumin" },
    { "id": "inr", "group": "coag", "part": "INR" },
    { "id": "imaging-us", "group": "imaging-us", "part": "ultrasound" }
  ],
  "scores": [
    { "id": "news2", "label": "NEWS2" },
    { "id": "qsofa", "label": "qSOFA" },
    { "id": "alvarado", "label": "Alvarado" },
    { "id": "air", "label": "AIR" },
    { "id": "glasgow-blatchford", "label": "Glasgow-Blatchford" },
    { "id": "curb65", "label": "CURB-65" },
    { "id": "wells-pe", "label": "Wells PE" },
    { "id": "wells-dvt", "label": "Wells DVT" },
    { "id": "caprini", "label": "Caprini" },
    { "id": "rcri", "label": "RCRI" },
    { "id": "bisap", "label": "BISAP" },
    { "id": "tg18-cholecystitis", "label": "TG18 cholecystitis" },
    { "id": "tg18-cholangitis", "label": "TG18 cholangitis" }
  ],
  "decisionInputs": [
    { "key": "cfs", "group": "cfs", "probe": 7 },
    { "key": "asa", "group": "asa", "probe": 4 },
    { "key": "egfr", "group": "renal", "concept": "egfr", "probe": 25 },
    { "key": "pregnancy", "group": "pregnancy", "probe": "pregnant" },
    { "key": "bmi", "group": "weight", "concepts": ["height", "weight"], "probe": 42 },
    { "key": "hasBled", "group": "has-bled", "probe": 3 },
    { "key": "news2", "group": "obs", "concepts": ["rr", "spo2", "o2", "sbp", "hr", "avpu", "temp"], "probe": 7 }
  ],
  "thresholds": {
    "pregnancyAgeMin": 12,
    "pregnancyAgeMax": 55,
    "weightAgeBelow": 16,
    "alvaradoFeverC": 37.3,
    "alvaradoWbc": 10,
    "alvaradoNeutrophilPct": 75,
    "airFeverC": 38.5,
    "airPmnPct": [70, 85],
    "airWbc": [10, 15],
    "airCrp": [10, 50],
    "gbsHrAbove": 100,
    "curbUreaAbove": 7,
    "curbRrAtLeast": 30,
    "curbSbpBelow": 90,
    "curbDbpAtMost": 60,
    "curbAgeAtLeast": 65,
    "wellsPeHrAbove": 100,
    "capriniBmiAbove": 25,
    "rcriCreatinineAbove": 177,
    "bisapUreaAbove": 8.9,
    "bisapAgeAbove": 60,
    "sirsTempBelow": 36,
    "sirsTempAbove": 38,
    "sirsHrAbove": 90,
    "sirsRrAbove": 20,
    "sirsWbcBelow": 4,
    "sirsWbcAbove": 12,
    "neutrophilAbsoluteMax": 20
  },
  "terms": {
    "anticoagulants": ["warfarin", "acenocoumarol", "phenindione", "apixaban", "rivaroxaban", "edoxaban", "dabigatran", "enoxaparin", "dalteparin", "tinzaparin", "fondaparinux", "heparin"],
    "renalDrugs": ["ibuprofen", "naproxen", "diclofenac", "ketorolac", "indometacin", "indomethacin", "celecoxib", "etoricoxib", "meloxicam", "mefenamic", "piroxicam", "parecoxib", "nsaid", "metformin", "gentamicin", "amikacin", "tobramycin", "vancomycin", "nitrofurantoin", "lithium", "digoxin", "gabapentin", "pregabalin", "apixaban", "rivaroxaban", "edoxaban", "dabigatran", "enoxaparin", "dalteparin", "tinzaparin", "fondaparinux", "aciclovir", "valaciclovir", "co-trimoxazole", "trimethoprim", "methotrexate", "morphine", "tramadol"],
    "nsaids": ["ibuprofen", "naproxen", "diclofenac", "ketorolac", "indometacin", "indomethacin", "celecoxib", "etoricoxib", "meloxicam", "mefenamic", "piroxicam", "parecoxib", "nsaid"],
    "ionisingImaging": ["ct", "ctpa", "cect", "computed tomography", "x-ray", "xray", "radiograph", "cxr", "axr", "ercp", "fluoroscopy", "barium", "angiogram", "angiography", "hida", "nuclear medicine", "pet", "mcug", "ivu", "kub"],
    "contrast": ["contrast", "ctpa", "cect", "ct angiogram", "ct angiography", "ct urogram", "ivu"],
    "insulinDrugs": ["insulin", "glargine", "detemir", "degludec", "lantus", "levemir", "tresiba", "humulin", "novomix", "novorapid", "humalog", "actrapid", "mixtard"],
    "lastDose": ["last dose", "last taken", "last tablet", "last injection", "last took", "held since", "omitted since", "stopped on", "stopped at", "not taken since", "last warfarin", "last apixaban", "last rivaroxaban", "last edoxaban", "last dabigatran", "last enoxaparin"],
    "history": {
      "cancer": ["cancer", "carcinoma", "malignan", "lymphoma", "leukaemia", "leukemia", "metasta", "sarcoma", "myeloma"],
      "priorDvt": ["deep vein thrombosis", "deep venous thrombosis", "dvt"],
      "priorPe": ["pulmonary embol", "vte", "venous thromboembol"],
      "chf": ["heart failure", "cardiac failure", "ccf", "chf", "lvf", "congestive cardiac"],
      "ihd": ["ischaemic heart disease", "ischemic heart disease", "ihd", "angina", "myocardial infarction", "coronary artery disease", "cabg", "coronary stent", "nstemi", "stemi"],
      "cva": ["stroke", "cva", "tia", "transient ischaemic", "transient ischemic", "cerebrovascular"],
      "insulinDependent": ["type 1 diabetes", "t1dm", "iddm", "insulin-dependent diabetes", "insulin dependent diabetes", "insulin-treated diabetes", "insulin treated diabetes"],
      "liverDisease": ["cirrhosis", "liver disease", "liver failure", "portal hypertension", "chronic hepatitis"],
      "ibd": ["crohn", "ulcerative colitis", "inflammatory bowel", "ibd"],
      "varicoseVeins": ["varicose"],
      "ocpHrt": ["oral contraceptive", "combined pill", "hormone replacement", "hrt", "ocp", "microgynon", "estradiol", "oestradiol"],
      "immobile": ["bedbound", "bed-bound", "bedridden", "bed bound", "immobile", "immobilised", "immobilized", "plaster cast", "bed rest"]
    },
    "findings": {
      "migration": ["migrat", "moved to the right iliac", "moved to the rif", "shifted to the right iliac"],
      "anorexia": ["anorexia", "anorexic", "loss of appetite", "off food", "off her food", "off his food", "not eating", "poor appetite"],
      "nausea": ["nausea", "nauseated", "nauseous", "vomit", "emesis"],
      "vomiting": ["vomit", "emesis"],